{
    "$schema": "https://json-schema.org/draft/2020-12/schema",
    "$id": "competitor-report",
    "title": "Competitor Health Report",
    "description": "A report on scorable health metrics of a virtual casualty",
    "type": "object",
    "properties": {
        "casualty_id": {
            "type": "number",
            "minimum": 0,
            "multipleOf": 1
        },
        "team": {
            "type": "string"
        },
        "system": {
            "type": "string"
        },
        "location": {
            "type": "object",
            "properties": {
                "latitude": {
                    "type": "number",
                    "minimum": -90,
                    "maximum": 90
                },
                "longitude": {
                    "type": "number",
                    "exclusiveMinimum": -180,
                    "maximum": 180
                },
                "time_ago": {
                    "type": "number",
                    "minimum": 0
                }
            },
            "required": [
                "latitude",
                "longitude",
                "time_ago"
            ]
        },
        "severe_hemorrhage": {
            "type": "number",
            "minimum": 0,
            "maximum": 1,
            "multipleOf": 1
        },
        "respiratory_distress": {
            "type": "number",
            "minimum": 0,
            "maximum": 1,
            "multipleOf": 1
        },
        "hr": {
            "type": "object",
            "properties": {
                "value": {
                    "type": "number",
                    "minimum": 0
                },
                "time_ago": {
                    "type": "number",
                    "minimum": 0
                }
            },
            "required": [
                "value",
                "time_ago"
            ]
        },
        "rr": {
            "type": "object",
            "properties": {
                "value": {
                    "type": "number",
                    "minimum": 0
                },
                "time_ago": {
                    "type": "number",
                    "minimum": 0
                }
            },
            "required": [
                "value",
                "time_ago"
            ]
        },
        "temp": {
            "type": "object",
            "properties": {
                "value": {
                    "type": "number",
                    "minimum": 0
                },
                "time_ago": {
                    "type": "number",
                    "minimum": 0
                }
            },
            "required": [
                "value",
                "time_ago"
            ]
        },
        "trauma_head": {
            "type": "number",
            "minimum": 0,
            "maximum": 2,
            "multipleOf": 1
        },
        "trauma_torso": {
            "type": "number",
            "minimum": 0,
            "maximum": 2,
            "multipleOf": 1
        },
        "trauma_lower_ext": {
            "type": "number",
            "minimum": 0,
            "maximum": 3,
            "multipleOf": 1
        },
        "trauma_upper_ext": {
            "type": "number",
            "minimum": 0,
            "maximum": 3,
            "multipleOf": 1
        },
        "alertness_ocular": {
            "type": "object",
            "properties": {
                "value": {
                    "type": "number",
                    "minimum": 0,
                    "maximum": 2,
                    "multipleOf": 1
                },
                "time_ago": {
                    "type": "number",
                    "minimum": 0
                }
            },
            "required": [
                "value",
                "time_ago"
            ]
        },
        "alertness_verbal": {
            "type": "object",
            "properties": {
                "value": {
                    "type": "number",
                    "minimum": 0,
                    "maximum": 3,
                    "multipleOf": 1
                },
                "time_ago": {
                    "type": "number",
                    "minimum": 0
                }
            },
            "required": [
                "value",
                "time_ago"
            ]
        },
        "alertness_motor": {
            "type": "object",
            "properties": {
                "value": {
                    "type": "number",
                    "minimum": 0,
                    "maximum": 3,
                    "multipleOf": 1
                },
                "time_ago": {
                    "type": "number",
                    "minimum": 0
                }
            },
            "required": [
                "value",
                "time_ago"
            ]
        }
    },
    "required": [
        "casualty_id",
        "team",
        "system",
        "location"
    ],
    "additionalProperties": false,
    "minProperties": 7
}
